{"$schema":"https://json-schema.org/draft/2020-12/schema","$id":"https://voce.dev/schemas/evaluation-report/v1alpha1","title":"EvaluationReport","type":"object","properties":{"schemaVersion":{"const":"voce.evaluation-report/v1alpha1"},"id":{"type":"string"},"runId":{"type":"string"},"technicalOutcome":{"type":"string"},"technicalStatus":{"type":"string"},"structural":{"type":"object"},"semanticProposal":{"type":"object"},"humanAcceptance":{"type":"object"},"cleanup":{"type":"object"},"replay":{"type":"object"},"artifactIds":{"type":"array","items":{"type":"string"}},"sourceHashes":{"type":"object"},"status":{"enum":["complete","partial","needs_review","failed"]},"warnings":{"type":"array","items":{"type":"string"}},"reportHash":{"type":"string","pattern":"^sha256:[0-9a-f]{64}$"}},"required":["schemaVersion","id","runId","technicalOutcome","technicalStatus","cleanup","replay","artifactIds","sourceHashes","status","warnings","reportHash"],"additionalProperties":true}
